{
  "schema_version": "scaling-neuro.archive-manifest.v1",
  "upload_id": "0190f86f-e0de-7f2a-a24c-0a6abf16ec81",
  "site_id": "0190f870-1111-7f2a-a24c-0a6abf16ec81",
  "project_id": "0190f870-2222-7f2a-a24c-0a6abf16ec81",
  "consent_policy_version": "pilot-2026-07",
  "archive_prefix": "archive/v1/0190f870-1111-7f2a-a24c-0a6abf16ec81/0190f870-2222-7f2a-a24c-0a6abf16ec81/0190f86f-e0de-7f2a-a24c-0a6abf16ec81/",
  "client_version": "0.2.0",
  "created_at": "2026-07-12T03:14:02Z",
  "committed_at": "2026-07-12T03:19:44Z",
  "bundles": [
    {
      "bundle_id": "7c2a5f77f3ab6c6d9e011234",
      "series_id": "45fa0d3f9a2e9af111223344",
      "subject_id": "a4b73d9e6f12a2b011223344",
      "session_id": "b9e5cf2f5a74a3f811223344",
      "protocol_group_id": "27f2a6f4d9a3aa6b11223344",
      "bundle_hash": "1cf6de823a2aed6a62df853a7b1314a01e146bf079131d984977afc03760b0e2",
      "nii": {
        "key": "archive/v1/0190f870-1111-7f2a-a24c-0a6abf16ec81/0190f870-2222-7f2a-a24c-0a6abf16ec81/0190f86f-e0de-7f2a-a24c-0a6abf16ec81/7c2a5f77f3ab6c6d9e011234/sub-a4b73d9e6f12a2b011223344_ses-b9e5cf2f5a74a3f811223344_ser-45fa0d3f9a2e9af111223344_bold.nii.gz",
        "size": 184237921,
        "sha256": "85c21ffb8a905454f874b1a0391b6e3b54b8f4d256362a89ae95a4f42e794ea7",
        "uncompressed_sha256": "16dba13ef49dd70fce8a3a5f8bcfb201af58535312082bd73eec43baa8af6f67",
        "etag": "8e449734b10170d420a6ef80e8c5a519-3"
      },
      "metadata": {
        "key": "archive/v1/0190f870-1111-7f2a-a24c-0a6abf16ec81/0190f870-2222-7f2a-a24c-0a6abf16ec81/0190f86f-e0de-7f2a-a24c-0a6abf16ec81/7c2a5f77f3ab6c6d9e011234/sub-a4b73d9e6f12a2b011223344_ses-b9e5cf2f5a74a3f811223344_ser-45fa0d3f9a2e9af111223344_bold.json",
        "size": 5432,
        "sha256": "9da36272e3fc683b429e193a81a3aa2f9416be29b14241585257cc0e98759f90",
        "etag": "090faea915c15f0d47bfebbda6df5ee8"
      }
    }
  ],
  "control_plane": {
    "service_version": "0.2.0"
  }
}
